{
  "id": "act_define_data_model",
  "title": "确定 Weekloom 的核心数据字段",
  "project_id": "proj_weekloom",
  "week_id": "2026-W33",
  "category": "personal_project",
  "priority": "high",
  "weekly_role": "focus",
  "status": "done",
  "is_next_action": false,
  "due_date": "2026-08-16",
  "estimate_minutes": 60,
  "tags": ["电脑", "深度工作"],
  "notes": "形成 Project、Action、Week、Inbox Item、Review 五个实体的第一版定义。",
  "blocked_reason": null,
  "created_at": "2026-08-10T09:15:00-05:00",
  "updated_at": "2026-08-16T10:00:00-05:00",
  "completed_at": "2026-08-16T10:00:00-05:00"
}
